Subject,Age,FirstLanguage,Handedness,OtherLang,Sex,Block,CONDITION,COMPREHEND,Comprehension.ACC,Comprehension.RT,CRITICAL,Type,ITEM,NEAR,FAR,SAME,Sent.RT,SoundOut1.ACC,SoundOut1.RT,,,,,,,FARSOUND,,MASTER,MASTER.Cycle,MASTER.Sample,,NEARSOUND,NORESP,PFILL,Procedure,RESPONSE,Running,,SENT,Sent.ACC,Sent.CRESP,Sent.DurationError,Sent.OnsetDelay,Sent.OnsetTime,Sent.RESP,,Sent.RTTime,SFILL,SOUNDFILE,,SoundOut1.CRESP,SoundOut1.RESP,,SoundOut1.RTTime,SoundOut1.Tag16,19,english,right,japanese,male,5,,Are you in the mountains?,1,2676,,FILLER,NO16,,,,3139,1,463,,,,,,,,,5,1,5,,,16,NORSP/NORSP_16.wav,MAIN,k,MASTER,,You are hiking along the ridge - enjoying the sound of silence.,0,,-999999,7,359944,{SPACE},,363083,You are hiking along the ridge - enjoying the sound of silence.,NORSP/NORSP_16.wav,,k,k,,363765,16,19,english,right,japanese,male,6,,Is the sound of the drill quiet?,0,4877,,FILLER,NO23,,,,3484,1,479,,,,,,,,,5,1,6,,,23,NORSP/NORSP_23.wav,MAIN,k,MASTER,,The sound of the dentist's drill is deafening.,0,,-999999,6,366954,{SPACE},,370438,The sound of the dentist's drill is deafening.,NORSP/NORSP_23.wav,,k,k,,371138,16,19,english,right,japanese,male,7,FAR/LOUD,,1,0,4,CRITICAL,4,"As you are petting the cat, it meows.",A cat somewhere in your neighbor's yard meows.,DIFF,2385,1,240,,,,,,,CRITICALS/FAR/CRITICAL_04_FAR.wav,,3,1,7,,CRITICALS/NEAR/CRITICAL_04_NEAR.wav,,,MAIN,j,MASTER,,A cat somewhere in your neighbor's yard meows.,0,,-999999,7,376537,{SPACE},,378922,,CRITICALS/NEAR/CRITICAL_04_NEAR.wav,,j,j,,379389,16,19,english,right,japanese,male,8,FAR/QUIET,Are you in nature?,1,1895,24,CRITICAL,24,"As you walk through the forest, branches crack under your feet.","Somewhere off in the forest, branches are cracking under someone's feet.",SAME,2650,0,445,,,,,,,CRITICALS/FAR/CRITICAL_24_FAR.wav,,4,1,8,,CRITICALS/NEAR/CRITICAL_24_NEAR.wav,,,MAIN,j,MASTER,,"Somewhere off in the forest, branches are cracking under someone's feet.",0,,-999999,6,379935,{SPACE},,382585,,CRITICALS/FAR/CRITICAL_24_FAR.wav,,j,k,,383246,16,19,english,right,japanese,male,9,NEAR/QUIET,,1,0,17,CRITICAL,17,"As you walk up to the door, someone knocks on it.",You're sitting upstairs when someone knocks at the front door.,DIFF,4844,1,404,,,,,,,CRITICALS/FAR/CRITICAL_17_FAR.wav,,2,1,9,,CRITICALS/NEAR/CRITICAL_17_NEAR.wav,,,MAIN,j,MASTER,,"As you walk up to the door, someone knocks on it.",0,,-999999,6,385666,{SPACE},,390510,,CRITICALS/FAR/CRITICAL_17_FAR.wav,,j,j,,391135,16,19,english,right,japanese,male,10,,,1,0,,FILLER,NO19,,,,2497,1,575,,,,,,,,,5,1,10,,,19,NORSP/NORSP_19.wav,MAIN,k,MASTER,,"While you are cooking, the pleasing sound of the frying food makes you hungry.",0,,-999999,7,391677,{SPACE},,394174,"While you are cooking, the pleasing sound of the frying food makes you hungry.",NORSP/NORSP_19.wav,,k,k,,394971,16,19,english,right,japanese,male,11,NEAR/LOUD,,1,0,15,CRITICAL,15,"While you're horseback-riding, your horse neighs.","At the other end of the field, a horse neighs.",SAME,1921,1,323,,,,,,,CRITICALS/FAR/CRITICAL_15_FAR.wav,,1,1,11,,CRITICALS/NEAR/CRITICAL_15_NEAR.wav,,,MAIN,j,MASTER,,"While you're horseback-riding, your horse neighs.",0,,-999999,6,395515,{SPACE},,397436,,CRITICALS/NEAR/CRITICAL_15_NEAR.wav,,j,j,,397984,16,19,english,right,japanese,male,12,FAR/QUIET,Are you holding a bottle in your hand?,1,2266,5,CRITICAL,5,You hold the champagne bottle in your hand and pop it open.,"At the opposite end of the restaurant, someone pops a champagne bottle up.",SAME,3402,1,344,,,,,,,CRITICALS/FAR/CRITICAL_05_FAR.wav,,4,1,12,,CRITICALS/NEAR/CRITICAL_05_NEAR.wav,,,MAIN,j,MASTER,,"At the opposite end of the restaurant, someone pops a champagne bottle up.",0,,-999999,6,398527,{SPACE},,401929,,CRITICALS/FAR/CRITICAL_05_FAR.wav,,j,j,,402496,16,19,english,right,japanese,male,13,,Is the screaming kid close to you?,1,4054,,FILLER,NO22,,,,2408,1,446,,,,,,,,,5,1,13,,,22,NORSP/NORSP_22.wav,MAIN,k,MASTER,,From the other end of the hall you hear a kid scream.,0,,-999999,6,405271,{SPACE},,407679,From the other end of the hall you hear a kid scream.,NORSP/NORSP_22.wav,,k,k,,408343,16,19,english,right,japanese,male,14,FAR/QUIET,Did you open a can of soda slowly?,1,2425,23,CRITICAL,23,You quickly open the can of soda.,"Across the bar, a man quickly opens a can of soda.",SAME,6119,1,319,,,,,,,CRITICALS/FAR/CRITICAL_23_FAR.wav,,4,1,14,,CRITICALS/NEAR/CRITICAL_23_NEAR.wav,,,MAIN,j,MASTER,,"Across the bar, a man quickly opens a can of soda.",0,,-999999,6,412921,{SPACE},,419040,,CRITICALS/FAR/CRITICAL_23_FAR.wav,,j,j,,419584,16,19,english,right,japanese,male,15,,Is there a concert?,0,7295,,FILLER,NO17,,,,2366,0,500,,,,,,,,,5,1,15,,,17,NORSP/NORSP_17.wav,MAIN,k,MASTER,,"Sitting in the auditorium, you are listening to the brass band play.",0,,-999999,6,422517,{SPACE},,424883,"Sitting in the auditorium, you are listening to the brass band play.",NORSP/NORSP_17.wav,,k,j,,425603,16,19,english,right,japanese,male,16,,,1,0,,FILLER,NO03,,,,3152,1,789,,,,,,,,,5,1,16,,,3,NORSP/NORSP_03.wav,MAIN,k,MASTER,,"While riding a bus, you suddenly hear another passenger shout ""Help!""",0,,-999999,6,433419,{SPACE},,436571,"While riding a bus, you suddenly hear another passenger shout ""Help!""",NORSP/NORSP_03.wav,,k,k,,437580,16,19,english,right,japanese,male,17,,,1,0,,FILLER,NO10,,,,1879,1,494,,,,,,,,,5,1,17,,,10,NORSP/NORSP_10.wav,MAIN,k,MASTER,,Your father uses the dishwasher in the kitchen.,0,,-999999,7,438124,{SPACE},,440003,Your father uses the dishwasher in the kitchen.,NORSP/NORSP_10.wav,,k,k,,440724,16,19,english,right,japanese,male,18,,,1,0,,FILLER,NO12,,,,2708,0,343,,,,,,,,,5,1,18,,,12,NORSP/NORSP_12.wav,MAIN,k,MASTER,,You step inside the shower and listen to the water cascading over you.,0,,-999999,6,441269,{SPACE},,443977,You step inside the shower and listen to the water cascading over you.,NORSP/NORSP_12.wav,,k,j,,444544,16,19,english,right,japanese,male,19,,,1,0,,FILLER,NO13,,,,5857,1,487,,,,,,,,,5,1,19,,,13,NORSP/NORSP_13.wav,MAIN,k,MASTER,,The sound of the airconditioner only is annoying when it's close to you.,0,,-999999,7,445081,{SPACE},,450938,The sound of the airconditioner only is annoying when it's close to you.,NORSP/NORSP_13.wav,,k,k,,451645,16,19,english,right,japanese,male,20,,Are you in a warehouse?,1,2015,,FILLER,NO24,,,,2426,1,570,,,,,,,,,5,1,20,,,24,NORSP/NORSP_24.wav,MAIN,k,MASTER,,"At the other end of the office, you notice a computer producing a loud beep.",0,,-999999,6,452184,{SPACE},,454610,"At the other end of the office, you notice a computer producing a loud beep.",NORSP/NORSP_24.wav,,k,k,,455407,16,19,english,right,japanese,male,21,,Is the electric fan switched on?,1,7237,,FILLER,NO11,,,,2012,0,545,,,,,,,,,5,1,21,,,11,NORSP/NORSP_11.wav,MAIN,k,MASTER,,"As you are studying, the hum of the fan lulls you to sleep.",0,,-999999,6,457942,{SPACE},,459954,"As you are studying, the hum of the fan lulls you to sleep.",NORSP/NORSP_11.wav,,k,j,,460713,16,19,english,right,japanese,male,22,NEAR/LOUD,,1,0,22,CRITICAL,22,You stand next to the waterfall as the water cascades down.,"You stand across the valley from the waterfall, as the water cascades down.",SAME,4514,0,289,,,,,,,CRITICALS/FAR/CRITICAL_22_FAR.wav,,1,1,22,,CRITICALS/NEAR/CRITICAL_22_NEAR.wav,,,MAIN,j,MASTER,,You stand next to the waterfall as the water cascades down.,0,,-999999,6,468484,{SPACE},,472998,,CRITICALS/NEAR/CRITICAL_22_NEAR.wav,,j,k,,473505,16,19,english,right,japanese,male,23,FAR/LOUD,,1,0,16,CRITICAL,16,You are standing next to a construction worker using a jackhammer.,"Somewhere far away from you, a construction worker is using a jackhammer.",DIFF,3178,1,384,,,,,,,CRITICALS/FAR/CRITICAL_16_FAR.wav,,3,1,23,,CRITICALS/NEAR/CRITICAL_16_NEAR.wav,,,MAIN,j,MASTER,,"Somewhere far away from you, a construction worker is using a jackhammer.",0,,-999999,7,474042,{SPACE},,477220,,CRITICALS/NEAR/CRITICAL_16_NEAR.wav,,j,j,,477824,16,19,english,right,japanese,male,24,FAR/LOUD,,1,0,13,CRITICAL,13,You are using a hammer to pound a nail into the wall.,A construction worker down the hall pounds a nail into the wall.,DIFF,1927,1,445,,,,,,,CRITICALS/FAR/CRITICAL_13_FAR.wav,,3,1,24,,CRITICALS/NEAR/CRITICAL_13_NEAR.wav,,,MAIN,j,MASTER,,A construction worker down the hall pounds a nail into the wall.,0,,-999999,6,478360,{SPACE},,480287,,CRITICALS/NEAR/CRITICAL_13_NEAR.wav,,j,j,,480951,16,19,english,right,japanese,male,25,NEAR/QUIET,Did the clock strike a full hour?,1,3973,9,CRITICAL,9,The cuckoo-clock right above you strikes midnight.,"From the far end of the garden, you hear the cuckoo-clock strike 12.",DIFF,1957,1,600,,,,,,,CRITICALS/FAR/CRITICAL_09_FAR.wav,,2,1,25,,CRITICALS/NEAR/CRITICAL_09_NEAR.wav,,,MAIN,j,MASTER,,The cuckoo-clock right above you strikes midnight.,0,,-999999,6,481492,{SPACE},,483449,,CRITICALS/FAR/CRITICAL_09_FAR.wav,,j,j,,484264,16,19,english,right,japanese,male,26,,,1,0,,FILLER,NO09,,,,1700,1,521,,,,,,,,,5,1,26,,,9,NORSP/NORSP_09.wav,MAIN,k,MASTER,,"At the other end of the room, your friend snaps his fingers three times.",0,,-999999,7,488769,{SPACE},,490469,"At the other end of the room, your friend snaps his fingers three times.",NORSP/NORSP_09.wav,,k,k,,491209,16,19,english,right,japanese,male,27,,,1,0,,FILLER,NO04,,,,4770,0,252,,,,,,,,,5,1,27,,,4,NORSP/NORSP_04.wav,MAIN,k,MASTER,,"As you are touring the ranch, the cowboy guide next to you cracks his whip.",0,,-999999,6,491754,{SPACE},,496524,"As you are touring the ranch, the cowboy guide next to you cracks his whip.",NORSP/NORSP_04.wav,,k,j,,496991,16,19,english,right,japanese,male,28,,,1,0,,FILLER,NO08,,,,6505,0,417,,,,,,,,,5,1,28,,,8,NORSP/NORSP_08.wav,MAIN,k,MASTER,,You are standing next to the loud coffee grinder as it turns on.,0,,-999999,7,497539,{SPACE},,504044,You are standing next to the loud coffee grinder as it turns on.,NORSP/NORSP_08.wav,,k,j,,504686,16,19,english,right,japanese,male,29,NEAR/QUIET,,1,0,2,CRITICAL,2,You hear the baby crying in the crib right in front of you.,"In the day-care centre down the hall, you hear a baby crying.",DIFF,2113,1,365,,,,,,,CRITICALS/FAR/CRITICAL_02_FAR.wav,,2,1,29,,CRITICALS/NEAR/CRITICAL_02_NEAR.wav,,,MAIN,j,MASTER,,You hear the baby crying in the crib right in front of you.,0,,-999999,7,505229,{SPACE},,507342,,CRITICALS/FAR/CRITICAL_02_FAR.wav,,j,j,,507926,16,19,english,right,japanese,male,30,FAR/QUIET,Are you woken up by the blender?,1,4000,3,CRITICAL,3,"In the kitchen, you're using the blender to make a smoothie.",You're woken up by your mum downstairs using the blender.,SAME,6028,0,727,,,,,,,CRITICALS/FAR/CRITICAL_03_FAR.wav,,4,1,30,,CRITICALS/NEAR/CRITICAL_03_NEAR.wav,,,MAIN,j,MASTER,,You're woken up by your mum downstairs using the blender.,0,,-999999,6,508467,{SPACE},,514495,,CRITICALS/FAR/CRITICAL_03_FAR.wav,,j,k,,515445,16,19,english,right,japanese,male,31,NEAR/LOUD,,1,0,6,CRITICAL,6,"While you're touring the bell tower, the church bells start to ring.","In the neighboring town, the church bells are ringing.",SAME,2125,1,324,,,,,,,CRITICALS/FAR/CRITICAL_06_FAR.wav,,1,1,31,,CRITICALS/NEAR/CRITICAL_06_NEAR.wav,,,MAIN,j,MASTER,,"While you're touring the bell tower, the church bells start to ring.",0,,-999999,6,519969,{SPACE},,522094,,CRITICALS/NEAR/CRITICAL_06_NEAR.wav,,j,j,,522639,16,19,english,right,japanese,male,32,NEAR/QUIET,,1,0,20,CRITICAL,20,"As you hold the frog in your hands, it starts to croak.","At the other end of the pond, a frog starts to croak.",DIFF,1651,0,374,,,,,,,CRITICALS/FAR/CRITICAL_20_FAR.wav,,2,1,32,,CRITICALS/NEAR/CRITICAL_20_NEAR.wav,,,MAIN,j,MASTER,,"As you hold the frog in your hands, it starts to croak.",0,,-999999,7,523181,{SPACE},,524832,,CRITICALS/FAR/CRITICAL_20_FAR.wav,,j,k,,525421,16,19,english,right,japanese,male,33,FAR/LOUD,Are you touching the cow?,1,2380,7,CRITICAL,7,"While you're milking the cow, it starts mooing.","Across the field, the cow starts mooing.",DIFF,3015,1,304,,,,,,,CRITICALS/FAR/CRITICAL_07_FAR.wav,,3,1,33,,CRITICALS/NEAR/CRITICAL_07_NEAR.wav,,,MAIN,j,MASTER,,"Across the field, the cow starts mooing.",0,,-999999,6,525966,{SPACE},,528981,,CRITICALS/NEAR/CRITICAL_07_NEAR.wav,,j,j,,529509,16,19,english,right,japanese,male,34,NEAR/LOUD,Is the dog growling?,1,1359,11,CRITICAL,11,"Right next to you, the dog is barking.","In your neighbor's yard, a dog is barking.",SAME,1267,1,301,,,,,,,CRITICALS/FAR/CRITICAL_11_FAR.wav,,1,1,34,,CRITICALS/NEAR/CRITICAL_11_NEAR.wav,,,MAIN,j,MASTER,,"Right next to you, the dog is barking.",0,,-999999,7,532404,{SPACE},,533671,,CRITICALS/NEAR/CRITICAL_11_NEAR.wav,,j,j,,534197,16,19,english,right,japanese,male,35,NEAR/QUIET,,1,0,10,CRITICAL,10,You step into the chicken coop and a rooster crows.,"Early in the morning, the rooster down the hill crows.",DIFF,1864,1,658,,,,,,,CRITICALS/FAR/CRITICAL_10_FAR.wav,,2,1,35,,CRITICALS/NEAR/CRITICAL_10_NEAR.wav,,,MAIN,j,MASTER,,You step into the chicken coop and a rooster crows.,0,,-999999,7,536069,{SPACE},,537933,,CRITICALS/FAR/CRITICAL_10_FAR.wav,,j,j,,538806,16,19,english,right,japanese,male,36,,,1,0,,FILLER,NO05,,,,1769,1,421,,,,,,,,,5,1,36,,,5,NORSP/NORSP_05.wav,MAIN,k,MASTER,,"As you are petting the donkey, it goes ""hee-haw"".",0,,-999999,6,539347,{SPACE},,541116,"As you are petting the donkey, it goes ""hee-haw"".",NORSP/NORSP_05.wav,,k,k,,541754,16,19,english,right,japanese,male,37,,,1,0,,FILLER,NO20,,,,2158,0,985,,,,,,,,,5,1,37,,,20,NORSP/NORSP_20.wav,MAIN,k,MASTER,,You hear somebody spraying graffiti right around the corner.,0,,-999999,7,542293,{SPACE},,544451,You hear somebody spraying graffiti right around the corner.,NORSP/NORSP_20.wav,,k,j,,545650,16,19,english,right,japanese,male,38,,,1,0,,FILLER,NO01,,,,3029,1,459,,,,,,,,,5,1,38,,,1,NORSP/NORSP_01.wav,MAIN,k,MASTER,,Right at your feet a fire cracker explodes.,0,,-999999,7,546185,{SPACE},,549214,Right at your feet a fire cracker explodes.,NORSP/NORSP_01.wav,,k,k,,549895,16,19,english,right,japanese,male,39,,,1,0,,FILLER,NO21,,,,1768,1,481,,,,,,,,,5,1,39,,,21,NORSP/NORSP_21.wav,MAIN,k,MASTER,,"Somewhere down the hill, you hear a bike bell ring.",0,,-999999,6,550436,{SPACE},,552204,"Somewhere down the hill, you hear a bike bell ring.",NORSP/NORSP_21.wav,,k,k,,552903,16,19,english,right,japanese,male,40,FAR/QUIET,,1,0,8,CRITICAL,8,You are standing right in the middle of the applauding audience.,"From outside, you know the concert is over because the audience is applauding.",SAME,2941,0,630,,,,,,,CRITICALS/FAR/CRITICAL_08_FAR.wav,,4,1,40,,CRITICALS/NEAR/CRITICAL_08_NEAR.wav,,,MAIN,j,MASTER,,"From outside, you know the concert is over because the audience is applauding.",0,,-999999,6,553448,{SPACE},,556389,,CRITICALS/FAR/CRITICAL_08_FAR.wav,,j,k,,557263,16,19,english,right,japanese,male,41,NEAR/LOUD,,1,0,18,CRITICAL,18,"Right next to you, a machine gun is firing.","In the distance, a machine gun is firing.",SAME,3789,1,421,,,,,,,CRITICALS/FAR/CRITICAL_18_FAR.wav,,1,1,41,,CRITICALS/NEAR/CRITICAL_18_NEAR.wav,,,MAIN,j,MASTER,,"Right next to you, a machine gun is firing.",0,,-999999,6,557806,{SPACE},,561595,,CRITICALS/NEAR/CRITICAL_18_NEAR.wav,,j,j,,562239,16,19,english,right,japanese,male,42,FAR/QUIET,,1,0,14,CRITICAL,14,The Harley Davidson right in front of you is rumbling.,"Blocks away, a Harley Davidson is rumbling.",SAME,1825,1,855,,,,,,,CRITICALS/FAR/CRITICAL_14_FAR.wav,,4,1,42,,CRITICALS/NEAR/CRITICAL_14_NEAR.wav,,,MAIN,j,MASTER,,"Blocks away, a Harley Davidson is rumbling.",0,,-999999,6,562777,{SPACE},,564602,,CRITICALS/FAR/CRITICAL_14_FAR.wav,,j,j,,565672,16,19,english,right,japanese,male,43,FAR/LOUD,,1,0,19,CRITICAL,19,The sheep walks up to you and bleats.,The sheep wanders to the other side of the hill from you and bleats.,DIFF,5407,1,347,,,,,,,CRITICALS/FAR/CRITICAL_19_FAR.wav,,3,1,43,,CRITICALS/NEAR/CRITICAL_19_NEAR.wav,,,MAIN,j,MASTER,,The sheep wanders to the other side of the hill from you and bleats.,0,,-999999,6,566216,{SPACE},,571623,,CRITICALS/NEAR/CRITICAL_19_NEAR.wav,,j,j,,572187,16,19,english,right,japanese,male,44,,,1,0,,FILLER,NO07,,,,4347,1,457,,,,,,,,,5,1,44,,,7,NORSP/NORSP_07.wav,MAIN,k,MASTER,,"While washing the dishes, you turn on the garbage disposal.",0,,-999999,6,572733,{SPACE},,577080,"While washing the dishes, you turn on the garbage disposal.",NORSP/NORSP_07.wav,,k,k,,577762,16,19,english,right,japanese,male,45,,Were you about to arrive?,1,3550,,FILLER,NO18,,,,1976,1,538,,,,,,,,,5,1,45,,,18,NORSP/NORSP_18.wav,MAIN,k,MASTER,,You were just about to leave when you hear a friend call your name.,0,,-999999,6,578304,{SPACE},,580280,You were just about to leave when you hear a friend call your name.,NORSP/NORSP_18.wav,,k,k,,581041,16,19,english,right,japanese,male,46,NEAR/QUIET,Is the toilet above you?,1,2458,21,CRITICAL,21,You stand in front of the toilet and flush it.,Someone upstairs flushes the toilet.,DIFF,4113,1,503,,,,,,,CRITICALS/FAR/CRITICAL_21_FAR.wav,,2,1,46,,CRITICALS/NEAR/CRITICAL_21_NEAR.wav,,,MAIN,j,MASTER,,You stand in front of the toilet and flush it.,0,,-999999,7,585115,{SPACE},,589228,,CRITICALS/FAR/CRITICAL_21_FAR.wav,,j,j,,589949,16,19,english,right,japanese,male,47,,Are you close to water?,1,1887,,FILLER,NO15,,,,4287,1,463,,,,,,,,,5,1,47,,,15,NORSP/NORSP_15.wav,MAIN,k,MASTER,,You are standing on the beach and listening to the sound of the ocean.,0,,-999999,7,592925,{SPACE},,597212,You are standing on the beach and listening to the sound of the ocean.,NORSP/NORSP_15.wav,,k,k,,597892,16,19,english,right,japanese,male,48,,,1,0,,FILLER,NO14,,,,4423,1,543,,,,,,,,,5,1,48,,,14,NORSP/NORSP_14.wav,MAIN,k,MASTER,,"When you put your headphones on, you realize that the song is far too loud.",0,,-999999,7,600295,{SPACE},,604718,"When you put your headphones on, you realize that the song is far too loud.",NORSP/NORSP_14.wav,,k,k,,605476,17,18,English,right,0,male,1,FAR/LOUD,,1,0,19,CRITICAL,19,The sheep walks up to you and bleats.,The sheep wanders to the other side of the hill from you and bleats.,DIFF,6862,1,680,,,,,,,CRITICALS/FAR/CRITICAL_19_FAR.wav,,3,1,1,,CRITICALS/NEAR/CRITICAL_19_NEAR.wav,,,MAIN,j,MASTER,,The sheep wanders to the other side of the hill from you and bleats.,0,,-999999,3,294507,{SPACE},,301369,,CRITICALS/NEAR/CRITICAL_19_NEAR.wav,,j,j,,302264,17,18,English,right,0,male,2,FAR/QUIET,,1,0,17,CRITICAL,17,"As you walk up to the door, someone knocks on it.",You're sitting upstairs when someone knocks at the front door.,SAME,3069,1,689,,,,,,,CRITICALS/FAR/CRITICAL_17_FAR.wav,,4,1,2,,CRITICALS/NEAR/CRITICAL_17_NEAR.wav,,,MAIN,j,MASTER,,You're sitting upstairs when someone knocks at the front door.,0,,-999999,7,302810,{SPACE},,305879,,CRITICALS/FAR/CRITICAL_17_FAR.wav,,j,j,,306791,17,18,English,right,0,male,3,,Is the sound of the drill quiet?,0,5848,,FILLER,NO23,,,,2044,1,792,,,,,,,,,5,1,3,,,23,NORSP/NORSP_23.wav,MAIN,k,MASTER,,The sound of the dentist's drill is deafening.,0,,-999999,6,307328,{SPACE},,309372,The sound of the dentist's drill is deafening.,NORSP/NORSP_23.wav,,k,k,,310386,17,18,English,right,0,male,4,NEAR/QUIET,Did you open a can of soda slowly?,1,2897,23,CRITICAL,23,You quickly open the can of soda.,"Across the bar, a man quickly opens a can of soda.",DIFF,2926,1,649,,,,,,,CRITICALS/FAR/CRITICAL_23_FAR.wav,,2,1,4,,CRITICALS/NEAR/CRITICAL_23_NEAR.wav,,,MAIN,j,MASTER,,You quickly open the can of soda.,0,,-999999,7,316751,{SPACE},,319677,,CRITICALS/FAR/CRITICAL_23_FAR.wav,,j,j,,320545,17,18,English,right,0,male,5,,,1,0,,FILLER,NO01,,,,4364,1,479,,,,,,,,,5,1,5,,,1,NORSP/NORSP_01.wav,MAIN,k,MASTER,,Right at your feet a fire cracker explodes.,0,,-999999,6,323961,{SPACE},,328325,Right at your feet a fire cracker explodes.,NORSP/NORSP_01.wav,,k,k,,329025,17,18,English,right,0,male,6,NEAR/LOUD,,1,0,12,CRITICAL,12,You are drilling a screw into the wall with the power drill.,The construction worker across the street is using a power drill.,SAME,3365,1,691,,,,,,,CRITICALS/FAR/CRITICAL_12_FAR.wav,,1,1,6,,CRITICALS/NEAR/CRITICAL_12_NEAR.wav,,,MAIN,j,MASTER,,You are drilling a screw into the wall with the power drill.,0,,-999999,7,329572,{SPACE},,332937,,CRITICALS/NEAR/CRITICAL_12_NEAR.wav,,j,j,,333848,17,18,English,right,0,male,7,,Were you about to arrive?,1,3669,,FILLER,NO18,,,,4841,1,720,,,,,,,,,5,1,7,,,18,NORSP/NORSP_18.wav,MAIN,k,MASTER,,You were just about to leave when you hear a friend call your name.,0,,-999999,6,334383,{SPACE},,339224,You were just about to leave when you hear a friend call your name.,NORSP/NORSP_18.wav,,k,k,,340168,17,18,English,right,0,male,8,NEAR/QUIET,Is the dog growling?,1,1901,11,CRITICAL,11,"Right next to you, the dog is barking.","In your neighbor's yard, a dog is barking.",DIFF,1857,1,477,,,,,,,CRITICALS/FAR/CRITICAL_11_FAR.wav,,2,1,8,,CRITICALS/NEAR/CRITICAL_11_NEAR.wav,,,MAIN,j,MASTER,,"Right next to you, the dog is barking.",0,,-999999,7,344366,{SPACE},,346223,,CRITICALS/FAR/CRITICAL_11_FAR.wav,,j,j,,346922,17,18,English,right,0,male,9,NEAR/LOUD,Did the clock strike a full hour?,1,4089,9,CRITICAL,9,The cuckoo-clock right above you strikes midnight.,"From the far end of the garden, you hear the cuckoo-clock strike 12.",SAME,3693,1,456,,,,,,,CRITICALS/FAR/CRITICAL_09_FAR.wav,,1,1,9,,CRITICALS/NEAR/CRITICAL_09_NEAR.wav,,,MAIN,j,MASTER,,The cuckoo-clock right above you strikes midnight.,0,,-999999,7,349337,{SPACE},,353030,,CRITICALS/NEAR/CRITICAL_09_NEAR.wav,,j,j,,353711,17,18,English,right,0,male,10,NEAR/LOUD,,1,0,6,CRITICAL,6,"While you're touring the bell tower, the church bells start to ring.","In the neighboring town, the church bells are ringing.",SAME,7224,1,454,,,,,,,CRITICALS/FAR/CRITICAL_06_FAR.wav,,1,1,10,,CRITICALS/NEAR/CRITICAL_06_NEAR.wav,,,MAIN,j,MASTER,,"While you're touring the bell tower, the church bells start to ring.",0,,-999999,7,358320,{SPACE},,365544,,CRITICALS/NEAR/CRITICAL_06_NEAR.wav,,j,j,,366224,17,18,English,right,0,male,11,,,1,0,,FILLER,NO12,,,,3504,1,754,,,,,,,,,5,1,11,,,12,NORSP/NORSP_12.wav,MAIN,k,MASTER,,You step inside the shower and listen to the water cascading over you.,0,,-999999,6,366769,{SPACE},,370273,You step inside the shower and listen to the water cascading over you.,NORSP/NORSP_12.wav,,k,k,,371242,17,18,English,right,0,male,12,,,1,0,,FILLER,NO04,,,,5743,0,366,,,,,,,,,5,1,12,,,4,NORSP/NORSP_04.wav,MAIN,k,MASTER,,"As you are touring the ranch, the cowboy guide next to you cracks his whip.",0,,-999999,7,371781,{SPACE},,377524,"As you are touring the ranch, the cowboy guide next to you cracks his whip.",NORSP/NORSP_04.wav,,k,j,,378104,17,18,English,right,0,male,13,NEAR/QUIET,Are you touching the cow?,0,3547,7,CRITICAL,7,"While you're milking the cow, it starts mooing.","Across the field, the cow starts mooing.",DIFF,5454,1,747,,,,,,,CRITICALS/FAR/CRITICAL_07_FAR.wav,,2,1,13,,CRITICALS/NEAR/CRITICAL_07_NEAR.wav,,,MAIN,j,MASTER,,"While you're milking the cow, it starts mooing.",0,,-999999,6,378644,{SPACE},,384098,,CRITICALS/FAR/CRITICAL_07_FAR.wav,,j,j,,385069,17,18,English,right,0,male,14,NEAR/QUIET,,1,0,22,CRITICAL,22,You stand next to the waterfall as the water cascades down.,"You stand across the valley from the waterfall, as the water cascades down.",DIFF,4632,1,866,,,,,,,CRITICALS/FAR/CRITICAL_22_FAR.wav,,2,1,14,,CRITICALS/NEAR/CRITICAL_22_NEAR.wav,,,MAIN,j,MASTER,,You stand next to the waterfall as the water cascades down.,0,,-999999,7,389147,{SPACE},,393779,,CRITICALS/FAR/CRITICAL_22_FAR.wav,,j,j,,394864,17,18,English,right,0,male,15,,,1,0,,FILLER,NO03,,,,5252,1,785,,,,,,,,,5,1,15,,,3,NORSP/NORSP_03.wav,MAIN,k,MASTER,,"While riding a bus, you suddenly hear another passenger shout ""Help!""",0,,-999999,7,395411,{SPACE},,400663,"While riding a bus, you suddenly hear another passenger shout ""Help!""",NORSP/NORSP_03.wav,,k,k,,401673,17,18,English,right,0,male,16,NEAR/LOUD,Is the toilet above you?,1,2356,21,CRITICAL,21,You stand in front of the toilet and flush it.,Someone upstairs flushes the toilet.,SAME,2158,1,566,,,,,,,CRITICALS/FAR/CRITICAL_21_FAR.wav,,1,1,16,,CRITICALS/NEAR/CRITICAL_21_NEAR.wav,,,MAIN,j,MASTER,,You stand in front of the toilet and flush it.,0,,-999999,7,402208,{SPACE},,404366,,CRITICALS/NEAR/CRITICAL_21_NEAR.wav,,j,j,,405146,17,18,English,right,0,male,17,,Is there a concert?,0,1859,,FILLER,NO17,,,,4273,1,1060,,,,,,,,,5,1,17,,,17,NORSP/NORSP_17.wav,MAIN,k,MASTER,,"Sitting in the auditorium, you are listening to the brass band play.",0,,-999999,7,408019,{SPACE},,412292,"Sitting in the auditorium, you are listening to the brass band play.",NORSP/NORSP_17.wav,,k,k,,413570,17,18,English,right,0,male,18,FAR/QUIET,,1,0,4,CRITICAL,4,"As you are petting the cat, it meows.",A cat somewhere in your neighbor's yard meows.,SAME,3595,1,696,,,,,,,CRITICALS/FAR/CRITICAL_04_FAR.wav,,4,1,18,,CRITICALS/NEAR/CRITICAL_04_NEAR.wav,,,MAIN,j,MASTER,,A cat somewhere in your neighbor's yard meows.,0,,-999999,6,415948,{SPACE},,419543,,CRITICALS/FAR/CRITICAL_04_FAR.wav,,j,j,,420456,17,18,English,right,0,male,19,,,1,0,,FILLER,NO14,,,,4500,1,774,,,,,,,,,5,1,19,,,14,NORSP/NORSP_14.wav,MAIN,k,MASTER,,"When you put your headphones on, you realize that the song is far too loud.",0,,-999999,7,421000,{SPACE},,425500,"When you put your headphones on, you realize that the song is far too loud.",NORSP/NORSP_14.wav,,k,k,,426492,17,18,English,right,0,male,20,,,1,0,,FILLER,NO02,,,,3940,1,716,,,,,,,,,5,1,20,,,2,NORSP/NORSP_02.wav,MAIN,k,MASTER,,Your friend leaves the room and accidently slams the door right in your face.,0,,-999999,6,427037,{SPACE},,430977,Your friend leaves the room and accidently slams the door right in your face.,NORSP/NORSP_02.wav,,k,k,,431911,17,18,English,right,0,male,21,,,1,0,,FILLER,NO06,,,,4526,0,540,,,,,,,,,5,1,21,,,6,NORSP/NORSP_06.wav,MAIN,k,MASTER,,You step inside the shower and listen to the water cascading over you.,0,,-999999,6,432448,{SPACE},,436974,You step inside the shower and listen to the water cascading over you.,NORSP/NORSP_06.wav,,k,j,,437733,